title,link,snippet,displayLink
Vertex AI Agent Builder | Google Cloud,https://cloud.google.com/products/agent-builder,"Apr 9, 2025 ... Debug and optimize agent performance. Enhance your agent applications with debugging and optimization capabilities built into Vertex AI. Use tracing to ...",cloud.google.com
AAAI-25 Workshop List - AAAI,https://aaai.org/conference/aaai/aaai-25/workshop-list/,"Nov 22, 2024 ... ... debugging, and repair; Applications of large-language models for quantum ... W42: Large Language Model and Generative AI for Health. The rapid evolution ...",aaai.org
Utilizing Generative AI and LLMs to Automate Detection Writing | by ...,https://medium.com/@dylanhwilliams/utilizing-generative-ai-and-llms-to-automate-detection-writing-5e4ea074072e,"May 10, 2024 ... (Optional) F*ck up the whole process on the way here through syntax errors, typos, going back and forth between python, JSON and SQL, debugging, troubleshooting ...",medium.com
Designing and Building AI Agent Products,https://www.linkedin.com/pulse/designing-building-ai-agent-products-sanjay-kumar-mba-ms-phd-p2znc,"Mar 8, 2025 ... Understanding and Generating Natural Language – Enables AI chatbots, writing assistants, and question-answering agents. Code Generation and Debugging – Assists ...",www.linkedin.com
Report of the Generative AI and Natural Language Processing Task ...,https://doit.illinois.gov/content/dam/soi/en/web/doit/meetings/ai-taskforce/reports/2024-gen-ai-task-force-report.pdf,"Jan 31, 2024 ... Software Development: Generative AI like GitHub Copilot assists in writing and debugging code, reducing the time and need for junior developers in Illinois'.",doit.illinois.gov
Top 9 Large Language Models as of May 2025 | Shakudo,https://www.shakudo.io/blog/top-9-large-language-models,"May 1, 2025 ... This model boasts from 0.5 billion to 72 billion parameters, featuring context windows of up to 128,000 tokens, and is excellent for code generation, debugging, ...",www.shakudo.io
Autogen: multi-agent large language models (LLM-MA) to solve ...,https://nathan.gs/2024/06/23/autogen-multi-agent-llms-to-solve-complex-tasks/,"Jun 23, 2024 ... Code Generation: execution, and debugging: AutoGen can help developers write, run, and fix code using LLMs, tools, and human feedback. For example, an ...",nathan.gs
Artificial Intelligence Risk Management Framework: Generative ...,https://nvlpubs.nist.gov/nistpubs/ai/NIST.AI.600-1.pdf,"Jul 25, 2024 ... Re-assess model risks after fine-tuning or retrieval-augmented generation ... un-tuned (baseline) models supports debugging the relative influence of the pre-.",nvlpubs.nist.gov
From LLMs to LLM-based Agents for Software Engineering: A ...,https://arxiv.org/html/2408.02479v1/,"Aug 5, 2024 ... ... multi-agent systems outperform single-agent systems in complex debugging ... Wu, “Leveraging print debugging to improve code generation in large language models,” ...",arxiv.org
ICLR 2025 Schedule,https://iclr.cc/virtual/2025/calendar,"Apr 24, 2025 ... VisRAG: Vision-based Retrieval-augmented Generation on Multi ... HiBug2: Efficient and Interpretable Error Slice Discovery for Comprehensive Model Debugging.",iclr.cc
